{
  "model_version": "0.1.0",
  "model_family": "inc15c6d-arpah-fy2025-budget-request-chart",
  "source_publisher": "Advanced Research Projects Agency for Health",
  "source_title": "FY 2025 Congressional Justification",
  "source_period": "FY2025_budget_request_published_2024",
  "source_url": "https://arpa-h.gov/sites/default/files/2024-03/ARPA-H%20FY%202025.pdf",
  "source_original_path": "evidence/hhs-dab-omha-arpah-historical/originals/arpah_fy2025_cj/sha256/1e325bfe20151762242c7f59a5df21f0113c8644f431aec5debb22f5671493d1.pdf",
  "source_original_sha256": "1e325bfe20151762242c7f59a5df21f0113c8644f431aec5debb22f5671493d1",
  "source_git_blob_sha1": "2eed6072be324f47320f1878121d378936bf2ce0",
  "source_pdf_physical_pages": 51,
  "source_chart_pdf_physical_page": 6,
  "source_chart_printed_page": 2,
  "source_chart_figure_heading": "Organization Chart",
  "as_printed_chart_box_count": 15,
  "as_printed_director_root_count": 1,
  "as_printed_office_labels_beneath_director": 14,
  "source_footnote_proposes_reducing_offices_from": 14,
  "source_footnote_proposes_reducing_offices_to": 8,
  "published_footnote_reorganization_is_in_progress": true,
  "independently_verified_implementation_of_eight_office_chart": false,
  "no_current_organization_certification": true,
  "historical_source_observation_not_current_legal_roster": true,
  "current_legal_first_level_denominator": null,
  "independent_statutory_organization_certification_complete": false,
  "prior_hhs_exception_reference": "INC15C6-HHS-EXCEPTION-ARPAH",
  "prior_HHS_index_reference": "INC15C3-HHS-LINK-ARPA-H",
  "newly_minted_canonical_office_ids": 0,
  "items": [
    {
      "id": "INC15C6D-ARPAH-FY2025-BOX-01",
      "source_chart_box_position": 1,
      "publisher_text_label": "ARPA-H Office of the Director",
      "source_box_category": "publisher_chart_director_office",
      "source_visual_parent_box_id": null,
      "original_source_pdf_physical_page": 6,
      "source_figure_box_not_operational_structure": true,
      "source_office_alias_review_complete": false,
      "confirmed_current_legal_office_id": null,
      "present_day_still_active_verified": false,
      "realized_eight_office_reorganization_verified": false,
      "reporting_or_budget_delegation_verified": false,
      "source_manual_visual_transcription": true
    },
    {
      "id": "INC15C6D-ARPAH-FY2025-BOX-02",
      "source_chart_box_position": 2,
      "publisher_text_label": "Health Equity Dissemination and Implementation",
      "source_box_category": "publisher_chart_mission_office_label",
      "source_visual_parent_box_id": "INC15C6D-ARPAH-FY2025-BOX-01",
      "original_source_pdf_physical_page": 6,
      "source_figure_box_not_operational_structure": true,
      "source_office_alias_review_complete": false,
      "confirmed_current_legal_office_id": null,
      "present_day_still_active_verified": false,
      "realized_eight_office_reorganization_verified": false,
      "reporting_or_budget_delegation_verified": false,
      "source_manual_visual_transcription": true
    },
    {
      "id": "INC15C6D-ARPAH-FY2025-BOX-03",
      "source_chart_box_position": 3,
      "publisher_text_label": "Health Data Office",
      "source_box_category": "publisher_chart_mission_office_label",
      "source_visual_parent_box_id": "INC15C6D-ARPAH-FY2025-BOX-01",
      "original_source_pdf_physical_page": 6,
      "source_figure_box_not_operational_structure": true,
      "source_office_alias_review_complete": false,
      "confirmed_current_legal_office_id": null,
      "present_day_still_active_verified": false,
      "realized_eight_office_reorganization_verified": false,
      "reporting_or_budget_delegation_verified": false,
      "source_manual_visual_transcription": true
    },
    {
      "id": "INC15C6D-ARPAH-FY2025-BOX-04",
      "source_chart_box_position": 4,
      "publisher_text_label": "Treatment Innovation Office",
      "source_box_category": "publisher_chart_mission_office_label",
      "source_visual_parent_box_id": "INC15C6D-ARPAH-FY2025-BOX-01",
      "original_source_pdf_physical_page": 6,
      "source_figure_box_not_operational_structure": true,
      "source_office_alias_review_complete": false,
      "confirmed_current_legal_office_id": null,
      "present_day_still_active_verified": false,
      "realized_eight_office_reorganization_verified": false,
      "reporting_or_budget_delegation_verified": false,
      "source_manual_visual_transcription": true
    },
    {
      "id": "INC15C6D-ARPAH-FY2025-BOX-05",
      "source_chart_box_position": 5,
      "publisher_text_label": "Health Promotion & Disease Detection Office",
      "source_box_category": "publisher_chart_mission_office_label",
      "source_visual_parent_box_id": "INC15C6D-ARPAH-FY2025-BOX-01",
      "original_source_pdf_physical_page": 6,
      "source_figure_box_not_operational_structure": true,
      "source_office_alias_review_complete": false,
      "confirmed_current_legal_office_id": null,
      "present_day_still_active_verified": false,
      "realized_eight_office_reorganization_verified": false,
      "reporting_or_budget_delegation_verified": false,
      "source_manual_visual_transcription": true
    },
    {
      "id": "INC15C6D-ARPAH-FY2025-BOX-06",
      "source_chart_box_position": 6,
      "publisher_text_label": "Systems Technology Office",
      "source_box_category": "publisher_chart_mission_office_label",
      "source_visual_parent_box_id": "INC15C6D-ARPAH-FY2025-BOX-01",
      "original_source_pdf_physical_page": 6,
      "source_figure_box_not_operational_structure": true,
      "source_office_alias_review_complete": false,
      "confirmed_current_legal_office_id": null,
      "present_day_still_active_verified": false,
      "realized_eight_office_reorganization_verified": false,
      "reporting_or_budget_delegation_verified": false,
      "source_manual_visual_transcription": true
    },
    {
      "id": "INC15C6D-ARPAH-FY2025-BOX-07",
      "source_chart_box_position": 7,
      "publisher_text_label": "Health Resources & Policy Office",
      "source_box_category": "publisher_chart_mission_office_label",
      "source_visual_parent_box_id": "INC15C6D-ARPAH-FY2025-BOX-01",
      "original_source_pdf_physical_page": 6,
      "source_figure_box_not_operational_structure": true,
      "source_office_alias_review_complete": false,
      "confirmed_current_legal_office_id": null,
      "present_day_still_active_verified": false,
      "realized_eight_office_reorganization_verified": false,
      "reporting_or_budget_delegation_verified": false,
      "source_manual_visual_transcription": true
    },
    {
      "id": "INC15C6D-ARPAH-FY2025-BOX-08",
      "source_chart_box_position": 8,
      "publisher_text_label": "Acquisition & Contracting Office",
      "source_box_category": "publisher_chart_management_office_label",
      "source_visual_parent_box_id": "INC15C6D-ARPAH-FY2025-BOX-01",
      "original_source_pdf_physical_page": 6,
      "source_figure_box_not_operational_structure": true,
      "source_office_alias_review_complete": false,
      "confirmed_current_legal_office_id": null,
      "present_day_still_active_verified": false,
      "realized_eight_office_reorganization_verified": false,
      "reporting_or_budget_delegation_verified": false,
      "source_manual_visual_transcription": true
    },
    {
      "id": "INC15C6D-ARPAH-FY2025-BOX-09",
      "source_chart_box_position": 9,
      "publisher_text_label": "Innovation & Entrepreneurship Office",
      "source_box_category": "publisher_chart_management_office_label",
      "source_visual_parent_box_id": "INC15C6D-ARPAH-FY2025-BOX-01",
      "original_source_pdf_physical_page": 6,
      "source_figure_box_not_operational_structure": true,
      "source_office_alias_review_complete": false,
      "confirmed_current_legal_office_id": null,
      "present_day_still_active_verified": false,
      "realized_eight_office_reorganization_verified": false,
      "reporting_or_budget_delegation_verified": false,
      "source_manual_visual_transcription": true
    },
    {
      "id": "INC15C6D-ARPAH-FY2025-BOX-10",
      "source_chart_box_position": 10,
      "publisher_text_label": "Comptroller's Office",
      "source_box_category": "publisher_chart_management_office_label",
      "source_visual_parent_box_id": "INC15C6D-ARPAH-FY2025-BOX-01",
      "original_source_pdf_physical_page": 6,
      "source_figure_box_not_operational_structure": true,
      "source_office_alias_review_complete": false,
      "confirmed_current_legal_office_id": null,
      "present_day_still_active_verified": false,
      "realized_eight_office_reorganization_verified": false,
      "reporting_or_budget_delegation_verified": false,
      "source_manual_visual_transcription": true
    },
    {
      "id": "INC15C6D-ARPAH-FY2025-BOX-11",
      "source_chart_box_position": 11,
      "publisher_text_label": "Strategic Resources Office",
      "source_box_category": "publisher_chart_management_office_label",
      "source_visual_parent_box_id": "INC15C6D-ARPAH-FY2025-BOX-01",
      "original_source_pdf_physical_page": 6,
      "source_figure_box_not_operational_structure": true,
      "source_office_alias_review_complete": false,
      "confirmed_current_legal_office_id": null,
      "present_day_still_active_verified": false,
      "realized_eight_office_reorganization_verified": false,
      "reporting_or_budget_delegation_verified": false,
      "source_manual_visual_transcription": true
    },
    {
      "id": "INC15C6D-ARPAH-FY2025-BOX-12",
      "source_chart_box_position": 12,
      "publisher_text_label": "Strategic Planning Office",
      "source_box_category": "publisher_chart_management_office_label",
      "source_visual_parent_box_id": "INC15C6D-ARPAH-FY2025-BOX-01",
      "original_source_pdf_physical_page": 6,
      "source_figure_box_not_operational_structure": true,